{
  "schema_version": "blackout.policy_matrix.v1",
  "created_at_utc": "2026-08-12T07:34:28.498021+00:00",
  "matrix_config": {
    "seeds": [
      1401
    ],
    "side_swap": true,
    "opponent_id": "random-v1",
    "source_opponent_ids": [
      "opponent-random-v1",
      "random-v1"
    ],
    "opponent_sha256": "08326e77ea3ed37e18948e5098de228157ed430e490c2cd4717a11fa3260c6d1",
    "opponent_policy_seeds": {
      "1401": 515403
    },
    "executable_sha256": "49172f88b1ba2429677e7ec4a7876c4589876090be4888aeaef39269e29f4a69",
    "winner_source": "terminal_info.winner"
  },
  "results": {
    "random": {
      "model_policy_id": "model-random-v1",
      "source_series_id": "31fbf049-1eb8-48ad-b804-630f61f46c5b",
      "source_episode_ids": [
        "62845d37-356c-4604-99b9-313e809bf80c",
        "ea98ad20-3bf2-4f73-ac67-e8201967c424"
      ],
      "summary": {
        "episodes": 2,
        "wins": 1,
        "draws": 0,
        "losses": 1,
        "win_rate": 0.5,
        "mean_model_score_diff": -10.0,
        "by_model_side": {
          "A": {
            "episodes": 1,
            "wins": 1,
            "draws": 0,
            "losses": 0,
            "win_rate": 1.0,
            "mean_model_score_diff": 2.0
          },
          "B": {
            "episodes": 1,
            "wins": 0,
            "draws": 0,
            "losses": 1,
            "win_rate": 0.0,
            "mean_model_score_diff": -22.0
          }
        },
        "by_physical_side": {
          "A": {
            "episodes": 2,
            "wins": 2,
            "draws": 0,
            "losses": 0,
            "win_rate": 1.0,
            "mean_score_diff": 12.0
          },
          "B": {
            "episodes": 2,
            "wins": 0,
            "draws": 0,
            "losses": 2,
            "win_rate": 0.0,
            "mean_score_diff": -12.0
          }
        },
        "side_bias_diagnostics": {
          "model_side_win_rate_gap_a_minus_b": 1.0,
          "physical_win_rate_gap_a_minus_b": 1.0,
          "mean_score_diff_a_minus_b": 12.0,
          "balanced_model_side_exposure": true,
          "model_result_attribution_consistent": true,
          "evaluator_side_attribution_passed": true
        },
        "winner_derived_from_unity_shaping": false
      }
    },
    "scripted": {
      "model_policy_id": "scripted-battery-v1",
      "source_series_id": "5b5c8d99-167d-41aa-9b86-7f97f457ce55",
      "source_episode_ids": [
        "d5b405ea-77fa-437c-a407-6b80f5e7baa2",
        "9be74785-88ef-4def-993e-77d4d9170355"
      ],
      "summary": {
        "episodes": 2,
        "wins": 2,
        "draws": 0,
        "losses": 0,
        "win_rate": 1.0,
        "mean_model_score_diff": 95.5,
        "by_model_side": {
          "A": {
            "episodes": 1,
            "wins": 1,
            "draws": 0,
            "losses": 0,
            "win_rate": 1.0,
            "mean_model_score_diff": 97.0
          },
          "B": {
            "episodes": 1,
            "wins": 1,
            "draws": 0,
            "losses": 0,
            "win_rate": 1.0,
            "mean_model_score_diff": 94.0
          }
        },
        "by_physical_side": {
          "A": {
            "episodes": 2,
            "wins": 1,
            "draws": 0,
            "losses": 1,
            "win_rate": 0.5,
            "mean_score_diff": 1.5
          },
          "B": {
            "episodes": 2,
            "wins": 1,
            "draws": 0,
            "losses": 1,
            "win_rate": 0.5,
            "mean_score_diff": -1.5
          }
        },
        "side_bias_diagnostics": {
          "model_side_win_rate_gap_a_minus_b": 0.0,
          "physical_win_rate_gap_a_minus_b": 0.0,
          "mean_score_diff_a_minus_b": 1.5,
          "balanced_model_side_exposure": true,
          "model_result_attribution_consistent": true,
          "evaluator_side_attribution_passed": true
        },
        "winner_derived_from_unity_shaping": false
      }
    },
    "ippo": {
      "model_policy_id": "ippo-bc-warm-start-v1",
      "source_series_id": "9e494584-3174-4192-a0f4-29808a742289",
      "source_episode_ids": [
        "ca503828-1cb8-40ee-bd55-96f0326f84f4",
        "98001809-4ff2-4169-9cb3-ae734c70ccc4"
      ],
      "summary": {
        "episodes": 2,
        "wins": 0,
        "draws": 0,
        "losses": 2,
        "win_rate": 0.0,
        "mean_model_score_diff": -32.0,
        "by_model_side": {
          "A": {
            "episodes": 1,
            "wins": 0,
            "draws": 0,
            "losses": 1,
            "win_rate": 0.0,
            "mean_model_score_diff": -21.0
          },
          "B": {
            "episodes": 1,
            "wins": 0,
            "draws": 0,
            "losses": 1,
            "win_rate": 0.0,
            "mean_model_score_diff": -43.0
          }
        },
        "by_physical_side": {
          "A": {
            "episodes": 2,
            "wins": 1,
            "draws": 0,
            "losses": 1,
            "win_rate": 0.5,
            "mean_score_diff": 11.0
          },
          "B": {
            "episodes": 2,
            "wins": 1,
            "draws": 0,
            "losses": 1,
            "win_rate": 0.5,
            "mean_score_diff": -11.0
          }
        },
        "side_bias_diagnostics": {
          "model_side_win_rate_gap_a_minus_b": 0.0,
          "physical_win_rate_gap_a_minus_b": 0.0,
          "mean_score_diff_a_minus_b": 11.0,
          "balanced_model_side_exposure": true,
          "model_result_attribution_consistent": true,
          "evaluator_side_attribution_passed": true
        },
        "winner_derived_from_unity_shaping": false
      }
    }
  },
  "ranking": [
    "scripted",
    "random",
    "ippo"
  ]
}
